"Front","Back"
"Custody laws vary by state — some default to {{c1::equal shared custody::E S C}}, while others use {{c2::best interest of the child::B I C}} as their primary principle.",""
"Legal custody refers to {{c1::decision-making power::D-M P}}, while physical custody refers to {{c2::living arrangements::L A}}.",""
"Courts evaluate custody based on the child’s {{c1::relationship with each parent::R W E P}}, each parent’s {{c2::ability to provide stability, safety, and support::A T P S, S, S}}, and past {{c3::caregiving and involvement::C & I}}.",""
"Demonstrating {{c1::willingness to co-parent::W T C-P}} and avoiding a history of {{c2::abuse, neglect, or substance issues::A, N, S I}} supports a better custody case.",""
"Documenting custody matters requires keeping {{c1::calm, consistent records::C, C R}} of parenting time, school events, and communication.",""
"Important documentation includes {{c1::drop-offs and pickups::D & P}}, {{c2::school and medical involvement::S & M I}}, and {{c3::written communication::W C}} with the co-parent.",""
"Judges look for a {{c1::stable, kid-centered environment::S, K-C E}}, including housing, routine, school proximity, and emotional safety.",""
"A strong parenting plan includes a {{c1::detailed schedule::D S}}, decision roles for {{c2::health, education, religion::H, E, R}}, and {{c3::conflict resolution methods::C R M}}.",""
"Courts favor parents who show {{c1::respect for court orders::R F C O}}, {{c2::flexibility::F}}, and a {{c3::non-confrontational demeanor::N-C D}}.",""
"Even in an amicable divorce, hiring a {{c1::family law attorney::F L A}} helps protect long-term rights and prepare for mediation or court.",""
"Front","Back"
"As a stepparent, you’re in a {{c1::meaningful but legally limited position::M B L P}}.",""
"You should read the {{c1::parenting plan and divorce documents::P P & D D}} to understand custody, visitation, and decision-making.",""
"Legal documents show what’s been {{c1::agreed to::A T}}, what’s {{c2::required::R}}, and where you might spot {{c3::violations or obstacles::V / O}}.",""
"Important clauses to look for: {{c1::custody type::C T}}, {{c2::visitation schedules::V S}}, {{c3::relocation/dispute resolution::R / D R}}, {{c4::mention of stepparents::M O S}}, and {{c5::modification triggers::M T}}.",""
"Learning about family law helps you ask {{c1::better questions::B Q}}, understand {{c2::realistic outcomes::R O}}, and support your {{c3::partner’s organization and clarity::P O & C}}.",""
"Learn how courts define {{c1::best interest of the child::B I C}}, the difference between {{c2::modification and enforcement::M / E}}, and the limits of {{c3::stepparent rights::S R}}.",""
"Documentation and evidence are {{c1::central to court decisions::C T C D}}.",""
"Help your partner stay {{c1::organized::O}}, log events in a {{c2::calm, neutral tone::C, N T}}, and avoid {{c3::hostile communication around the child::H C A C}}.",""
"To support a custody modification, show a pattern of {{c1::stability, involvement, and benefit to the child::S, I, B C}}.",""
"As a stepparent, be a {{c1::source of calm, stability, and maturity::S O C, S, M}}.",""
"Do not try to {{c1::replace the other parent::R O P}}, but don’t {{c2::disappear from the child’s life::D F C L}} either.",""
"Model {{c1::healthy communication and respect::H C & R}}, especially during visible conflict.",""
"If you've played a major parenting role, ask your lawyer about {{c1::third-party custody rights or guardianship::T-P C R / G}}.",""
"Your {{c1::testimony::T}} may help your partner’s case if you’re actively involved in the child’s life.",""
"Front","Back"
"Document parenting time with notes on {{c1::drop-offs and pickups::D & P}}, {{c2::schedule changes::S C}}, and the {{c3::child’s emotional state::C E S}}.",""
"Note if the co-parent was {{c1::late, a no-show, or changed plans::L / N / C P}}.",""
"Save all {{c1::written communication::W C}} — preferably {{c2::text or email::T / E}}.",""
"Log any signs of {{c1::conflict, refusal to cooperate, or missed decisions::C / R T C / M D}}.",""
"Track school & medical involvement: {{c1::conferences::C}}, {{c2::homework::H}}, {{c3::appointments::A}}, and {{c4::non-participation::N-P}}.",""
"Note behavioral changes like {{c1::stress::S}}, {{c2::confusion::C}}, or {{c3::manipulative comments from the child::M C F T C}}.",""
"Also document positive involvement like {{c1::birthdays, vacations, and quality time::B / V / Q T}}.",""
"Use a {{c1::custody journal::C J}} with entries that include {{c2::date and time::D & T}} and a {{c3::calm, objective summary::C, O S}}.",""
"Use apps like {{c1::OurFamilyWizard::O F W}} or {{c2::TalkingParents::T P}} to formalize written co-parenting communication.",""
"A spreadsheet can help reveal {{c1::patterns::P}} in {{c2::missed visits::M V}}, {{c3::canceled plans::C P}}, or {{c4::school involvement gaps::S I G}}.",""
"Photos should be limited to {{c1::child wellbeing::C W}}, not for {{c2::evidence gathering::E G}} unless necessary.",""
"Do not speculate or editorialize in logs — avoid calling someone a {{c1::narcissist::N}} or labeling behavior without facts.",""
Front,Back
"Lawyers bill by the hour, so knowing vocabulary and process helps you {{c1::save money and speed up decisions::S M A S U D}}.",""
"Understanding legal terms lets you {{c1::spot favorable clauses and mistakes::S F C A M}}.",""
"Judges favor households that are {{c1::organized, child-focused, and reliable::O C F A R}}.",""
"You avoid wasting time and money by steering clear of {{c1::legal dead ends::L D E}}.",""
"Judges and mediators respond to {{c1::emotionally grounded, legally informed presentations::E G L I P}}.",""
"Staying calm and child-centered affects how {{c1::judicial discretion::J D}} is used.",""
"Unforced errors, like missing documentation, are less likely with {{c1::consistent preparation::C P}}.",""
"To know key terms and avoid confusion, spend {{c1::1–2 hrs/week on prep::1-2 H/W O P}}.",""
"To visibly improve outcomes, aim for {{c1::3–5 hrs/week of focused effort::3-5 H/W O F E}}.",""
"Law school level commitment (10+ hrs/week) can lead to {{c1::burnout and diminishing returns::B A D R}}.",""
"Studying 5–10 family law terms weekly with {{c1::Anki::A}} helps you stay sharp.",""
"Documenting weekly events neutrally takes about {{c1::30 minutes::30 M}} per week.",""
"Reading one legal explainer a week takes {{c1::30–45 minutes::30-45 M}} and adds clarity.",""
"Prepping attorney questions for 15 minutes improves {{c1::communication and efficiency::C A E}}.",""
"Spending 10–15 minutes reflecting helps with {{c1::emotional regulation and closure::E R A C}}.",""
Front,Back
"Legal learning helps you become a {{c1::smart legal teammate::S L T}} for your partner and lawyer.",""
"Judges notice when a parent is {{c1::calm, informed, and collaborative::C I A C}}.",""
"Understanding the legal framework helps you {{c1::catch mistakes or oversights::C M O}}.",""
"Learning helps you mentally {{c1::detach from spiraling emotion::D F S E}}.",""
"Having a legal study plan gives your brain {{c1::a job to do::A J T D}}.",""
"Family court is often driven by {{c1::discretion and perception::D A P}}.",""
"Clear logs and a child-centered plan can {{c1::tip the scale in your favor::T T S I Y F}}.",""
"A single well-prepared {{c1::hearing or mediation::H O M}} can improve custody schedules.",""
"Presenting stronger, clearer evidence can shift {{c1::parenting schedules::P S}}.",""
"The two biggest mistakes are doing {{c1::nothing or too much::N O T M}}.",""
"Doing nothing looks {{c1::disorganized::D}} in court.",""
"Doing too much can appear {{c1::controlling, obsessive, or combative::C O O C}}.",""
"The ideal posture is to be {{c1::quiet, consistent, and mature::Q C A M}}.",""
"Say: 'We’ve kept records. We’re ready to support the child. We’re not here to fight — just to {{c1::support what’s best for their future::S W B F T F}}.'",""
Front,Back
"Studying family law ~3 hours/week = {{c1::clear, measurable improvements::C M I}} in real-world outcomes.",""
"To gain an extra day/week of custody, aim for {{c1::structured, consistent effort::S C E}} over 3–6 months.",""
"Judges favor households that appear {{c1::stable, consistent, and reliable::S C A R}}.",""
"Time estimate to visibly shift custody outcomes: {{c1::50–90 hours total::5 9 H T}}.",""
"Documentation creates {{c1::provable evidence::P E}} of involvement and patterns.",""
"Supporting your attorney helps them avoid {{c1::assumptions and oversights::A A O}}.",""
"One well-prepared hearing can influence a judge’s {{c1::discretion::D}}.",""
"The real goal is to {{c1::tip the scale of credibility and plausibility::T T S O C A P}}.",""
"The sweet spot is showing {{c1::maturity and consistency::M A C}}, not overcontrol.",""
"Obsession in custody disputes looks like trying to {{c1::‘win’ at all costs::W A A C}}.",""
"A judge appreciates a household that is {{c1::informed, calm, and child-centered::I C A C}}.",""
"Focus on this tone: '{{c1::We’re not here to fight — just to support what’s best for their future::W N H T F J T S W B F T F}}'",""
Front,Back
"Minimum smart prep: {{c1::1–2 hrs/week::1 2 H W}} helps avoid confusion and improves lawyer efficiency.",""
"Moderate commitment: {{c1::3–5 hrs/week::3 5 H W}} visibly improves outcomes.",""
"Law school mode: {{c1::10+ hrs/week::1 0+ H W}} has {{c2::diminishing returns::D R}} and risk of burnout.",""
"Weekly task: Study 5–10 legal terms — {{c1::30 min in Anki::3 0 M I A}}.",""
"Weekly task: Log events — {{c1::30 min in a journal or spreadsheet::3 0 M I A J O S}}.",""
"Weekly task: Read 1 legal article — {{c1::30–45 min::3 0 4 5 M}}.",""
"Weekly task: Prep questions for your attorney — {{c1::15 min::1 5 M}}.",""
"Weekly task: Reflect on what’s in your control — {{c1::10–15 min::1 0 1 5 M}}.",""
"Studying ~2.5–3 hrs/week proves you are {{c1::intelligent, diligent, emotionally grounded::I D E G}}.",""
"Being informed shows your {{c1::attorney::A}} you’re reliable, your {{c2::court::C}} you’re stable, and yourself that you’re {{c3::not powerless::N P}}.",""
Front,Back
"Your goal: gain {{c1::an extra day of custody per week::A E D O C P W}} (e.g., from every other weekend to 50/50).",""
"A realistic shift is possible if your household is {{c1::stable, consistent, and child-benefiting::S C A C B}}.",""
"Legal learning time estimate: {{c1::30–50 hours total::3 0 5 0 H T}}, spread over 3–6 months.",""
"Documentation time estimate: {{c1::15–30 hours total::1 5 3 0 H T}}.",""
"Attorney support time estimate: {{c1::5–10 hours total::5 1 0 H T}}.",""
"Emotional/family work: ~{{c1::5 hours per month::5 H P M}} focused work.",""
"Total time estimate to clearly improve outcomes: {{c1::50–90 hours::5 0 9 0 H}}.",""
"Judges may shift custody if they see {{c1::clear logs, reasonable requests, calm demeanor, child-centered plan::C L R R C D C C P}}.",""
"One well-prepared mediation or hearing can tip the scale of {{c1::credibility and plausibility::C A P}}.",""
"Biggest mistake: doing either {{c1::nothing or way too much::N O W T M}}.",""
"Sweet spot posture: 'We’ve kept records, ready to support, not trying to {{c1::fight::F}}.'",""
Front,Back
"Minimum smart prep is about {{c1::1–2 hours/week::1 2 H W}}.",""
"This level helps you know key terms, avoid confusion, and help your lawyer {{c1::be efficient::B E}}.",""
"Moderate commitment is about {{c1::3–5 hours/week::3 5 H W}}.",""
"This level visibly improves outcomes: better evidence, calmer strategy, and {{c1::clearer requests::C R}}.",""
"Law school mode ({{c1::10+ hours/week::1 0 H W}}) is often counterproductive.",""
"Studying like a law student has high risk of {{c1::burnout, obsession, and diminishing returns::B O A D R}}.",""
"A simple weekly study structure includes studying {{c1::5–10 family law terms::5 1 0 F L T}}.",""
"Log weekly events with {{c1::neutral tone::N T}} in a journal or spreadsheet.",""
"Read 1 article or legal explainer for about {{c1::30–45 minutes/week::3 0 4 5 M W}}.",""
"Prep 1–2 questions for your attorney weekly in your {{c1::notes app or document::N A O D}}.",""
"Reflect weekly: focus on {{c1::what’s in your control, not what the court might do::W I Y C N W T C M D}}.",""
"This totals about {{c1::2.5–3 hours/week::2 5 3 H W}}, which is effective and manageable.",""
"Effort proves to your attorney that you're a {{c1::useful and reliable client::U A R C}}.",""
"Effort proves to the court your household is {{c1::capable, thoughtful, and child-centered::C T A C C}}.",""
"Effort proves to yourself that you’re {{c1::participating in a long-term solution::P I A L T S}}.",""
Front,Back
"To gain an extra day of custody per week, aim for {{c1::3–6 months of effort::3 6 M E}}.",""
"Having a {{c1::stable and consistent household::S A C H}} makes expanded custody more likely.",""
"Court decisions are influenced by how much {{c1::the child would benefit from more time::T C W B F M T}} with your household.",""
"Legal learning requires around {{c1::30–50 hours total::3 0 5 0 H T}}.",""
"Documentation requires about {{c1::15–30 hours total::1 5 3 0 H T}}.",""
"Supporting your attorney takes about {{c1::5–10 hours total::5 1 0 H T}}.",""
"Emotional regulation and household stability need {{c1::~5 focused hours/month::5 F H M}}.",""
"Total estimated time: {{c1::50–90 hours over 3–6 months::5 0 9 0 H 3 6 M}}.",""
"This equals about {{c1::3–4 hours/week::3 4 H W}}, enough to improve court presentation and documentation.",""
"Judges respond well to {{c1::clear logs, reasonable requests, and child-centered plans::C L R R C C P}}.",""
"One well-prepared mediation or hearing can {{c1::shift the parenting schedule::S T P S}}.",""
"Family court is influenced more by {{c1::discretion and perception::D A P}} than strict legal facts.",""
"To tip the scale, present with {{c1::calm demeanor and organized evidence::C D A O E}}.",""
"Doing nothing makes you look {{c1::disorganized::D}}; doing too much makes you seem {{c1::controlling or combative::C O C}}.",""
"The sweet spot: a {{c1::quiet, consistent, mature posture::Q C M P}}.",""
"Model mindset: “We’re not here to fight — we’re here to {{c1::support the child’s future::S T C F}}.”",""
Front,Back
"Studying law makes you a {{c1::smart legal teammate::S L T}} for your partner and lawyer.",""
"Judges notice when a household presents as {{c1::emotionally grounded, legally informed, and child-centered::E G L I C C}}.",""
"Studying law protects against mistakes like {{c1::missing outdated clauses or lawyer oversights::M O C L O}}.",""
"Learning gives your brain a {{c1::productive focus::P F}} during a difficult process.",""
"Commitment = {{c1::structured, goal-oriented effort::S G O E}}.",""
"Obsession = {{c1::compulsive scanning and control-seeking::C S A C S}}.",""
"Healthy habit: Set a {{c1::fixed weekly time limit::F W T L}} for study.",""
"Example habit: “{{c1::2 hours a week — Sundays after coffee::2 H A W S A C}}.”",""
"Example goal: “{{c1::Learn 5 legal terms and log events::L 5 L T L E}}.”",""
"Healthy closure: “We got Ella to the dentist and {{c1::sent school forms::S S F}}.”",""
"Focus on {{c1::what you can control::W Y C C}}, not outcomes.",""
"Study to {{c1::support your attorney::S Y A}}, not replace them.",""
"A basic study system includes an {{c1::Anki deck for terms::A D F T}}, a {{c1::logging template::L T}}, and {{c1::weekly study goals::W S G}}.",""
Front,Back
"{{c1::Better Custody/Parenting Time Terms::B C P T T}}","Judges favor stability and informed co-parenting."
"{{c1::Organized, child-focused, and reliable household::O C-F A R H}}","Becomes harder to argue against expanded custody or a fair revision of terms."
"{{c1::Stronger Legal Strategy::S L S}}","Helps your attorney make fewer assumptions, catch mistakes, and spot favorable clauses."
"{{c1::Improved Courtroom/Mediation Perception::I C/M P}}","Judges and mediators notice emotionally grounded, legally informed, and child-centered households."
"{{c1::Fewer Legal Setbacks::F L S}}","Avoid unforced errors like forgetting documentation, contradicting yourself, or making reactive emotional decisions."
"{{c1::Minimum Smart Prep::M S P}}","1–2 hrs/week: Know key terms, avoid confusion, help lawyer be efficient."
"{{c1::Moderate Commitment::M C}}","3–5 hrs/week: Visibly improve outcomes — better evidence, calmer strategy, clearer requests."
"{{c1::Law School Mode::L S M}}","10+ hrs/week: High risk of burnout, obsession, and diminishing returns."
"{{c1::Study 5–10 family law terms::S 5–10 F L T}}","30 min per week — builds vocabulary and understanding."
"{{c1::Document weekly events neutrally::D W E N}}","30 min per week — helps you present objective, calm records."
"{{c1::Read 1 article or watch 1 legal explainer::R 1 A/W 1 L E}}","30–45 min per week — boosts comprehension and context."
"{{c1::Prep questions for attorney::P Q F A}}","15 min per week — sharpens your legal communication and focus."
"{{c1::Reflect (what’s in your control?)::R (W I Y C?)}}","10–15 min per week — keeps emotional clarity and maturity."
Front,Back
"{{c1::Better Custody/Parenting Time Terms::B C P T T}}","Judges favor stability and informed co-parenting."
"{{c1::Organized, child-focused, and reliable household::O C-F A R H}}","Becomes harder to argue against expanded custody or a fair revision of terms."
"{{c1::Stronger Legal Strategy::S L S}}","Helps your attorney make fewer assumptions, catch mistakes, and spot favorable clauses."
"{{c1::Improved Courtroom/Mediation Perception::I C/M P}}","Judges and mediators notice emotionally grounded, legally informed, and child-centered households."
"{{c1::Fewer Legal Setbacks::F L S}}","Avoid unforced errors like forgetting documentation, contradicting yourself, or making reactive emotional decisions."
"{{c1::Minimum Smart Prep::M S P}}","1–2 hrs/week: Know key terms, avoid confusion, help lawyer be efficient."
"{{c1::Moderate Commitment::M C}}","3–5 hrs/week: Visibly improve outcomes — better evidence, calmer strategy, clearer requests."
"{{c1::Law School Mode::L S M}}","10+ hrs/week: High risk of burnout, obsession, and diminishing returns."
"{{c1::Study 5–10 family law terms::S 5–10 F L T}}","30 min per week — builds vocabulary and understanding."
"{{c1::Document weekly events neutrally::D W E N}}","30 min per week — helps you present objective, calm records."
"{{c1::Read 1 article or watch 1 legal explainer::R 1 A/W 1 L E}}","30–45 min per week — boosts comprehension and context."
"{{c1::Prep questions for attorney::P Q F A}}","15 min per week — sharpens your legal communication and focus."
"{{c1::Reflect (what’s in your control?)::R (W I Y C?)}}","10–15 min per week — keeps emotional clarity and maturity."
Front,Back
"{{c1::Doing nothing::D N}} (and looking {{c2::disorganized::D}})","One of the biggest mistakes people make in custody disputes."
"{{c1::Doing way too much::D W T M}} (and looking {{c2::controlling::C}}, {{c3::obsessive::O}}, or {{c4::combative::C}})","Another major pitfall that can harm your case."
"The recommended demeanor in custody proceedings is a {{c1::quiet::Q}}, {{c2::consistent::C}}, {{c3::mature posture::M P}}.","The best demeanor to present in family court."
"“We’ve kept records. We’re ready to support the child more. We’re not here to fight — just to support what’s best for their future.”","Example of a {{c1::quiet, consistent, mature posture::Q, C, M P}} to project in court or mediation."
"A {{c1::breakdown of exact tasks::B O E T}} can help you allocate time efficiently for legal prep.","Organizational tool that helps structure your custody efforts."
"An {{c1::Anki deck::A D}} to learn {{c2::legal terms::L T}} and {{c3::judge-pleasing language::J-P L}} makes you more articulate.","Useful tool to boost your legal vocabulary and tone."
"A {{c1::simple logging template::S L T}} is useful for tracking {{c2::events::E}} and {{c3::involvement::I}}.","Tool for clear and consistent custody documentation."
"You are {{c1::thinking about this the right way::T A T T R W}}.","Encouragement for taking a structured, thoughtful approach."
